Symbol,Name,Last Sale,Net Change,% Change,Market Cap,Country,IPO Year,Volume,Sector,Industry
PPYAW,Papaya Growth Opportunity Corp. I Warrant,$0.1489,0.0499,50.404%,0.00,United States,2022,100,Industrials,Consumer Electronics/Appliances
PRAA,PRA Group Inc. Common Stock,$40.81,0.10,0.246%,1590647697.00,United States,2002,93791,Finance,Advertising
PRAX,Praxis Precision Medicines Inc. Common Stock,$4.375,-0.155,-3.422%,206143779.00,United States,2020,1122357,Health Care,Biotechnology: Pharmaceutical Preparations
PRCH,Porch Group Inc. Common Stock,$3.555,0.065,1.862%,357471400.00,United States,2020,858568,Technology,Computer Software: Prepackaged Software
PRCT,PROCEPT BioRobotics Corporation Common Stock,$36.79,-0.04,-0.109%,1645250529.00,United States,2021,113932,Health Care,Medical Specialities
PRDO,Perdoceo Education Corporation Common Stock,$14.105,-0.595,-4.048%,947439268.00,United States,,687415,Consumer Discretionary,Other Consumer Services
PRDS,Pardes Biosciences Inc. Common Stock,$1.90,0.01,0.529%,117295252.00,United States,2021,27861,Health Care, Medicinal Chemicals and Botanical Products 
PRE,Prenetics Global Limited Class A Ordinary Share,$1.53,-0.04,-2.548%,181813832.00,Hong Kong,,102067,Industrials,Biotechnology: Laboratory Analytical Instruments
PRFT,Perficient Inc. Common Stock,$79.195,-0.255,-0.321%,2742399623.00,United States,1999,91370,Technology,EDP Services
PRFX,PainReform Ltd. Ordinary Shares,$0.53,0.025,4.95%,5636108.00,Israel,2020,20734,Health Care,Biotechnology: Pharmaceutical Preparations
PRGS,Progress Software Corporation Common Stock (DE),$57.64,1.62,2.892%,2498422343.00,United States,1991,218421,Technology,Computer Software: Prepackaged Software
PRIM,Primoris Services Corporation Common Stock,$25.93,0.00,0.00%,1377171005.00,United States,,91916,Industrials,Water Sewer Pipeline Comm & Power Line Construction
PRLD,Prelude Therapeutics Incorporated Common Stock,$7.25,0.11,1.541%,346983644.00,United States,2020,75020,Health Care, Medicinal Chemicals and Botanical Products 
PRLH,Pearl Holdings Acquisition Corp Class A Ordinary Shares,$10.34,-0.01,-0.097%,258500000.00,United States,2022,1384185,Finance,Business Services
PRLHW,Pearl Holdings Acquisition Corp Warrant,$0.091,0.00,0.00%,0.00,United States,2022,11,Finance,Business Services
PRME,Prime Medicine Inc. Common Stock,$20.075,-0.215,-1.06%,1951457466.00,United States,2022,126180,Health Care, Medicinal Chemicals and Botanical Products 
PROC,Procaps Group S.A. Ordinary Shares,$4.18,-0.17,-3.908%,471605085.00,Luxembourg,,13228,Health Care,Biotechnology: Pharmaceutical Preparations
PROCW,Procaps Group S.A. Warrants,$0.3199,0.0088,2.829%,0.00,Luxembourg,,350,Health Care,Biotechnology: Pharmaceutical Preparations
PROF,Profound Medical Corp. Common Stock,$12.7399,-0.1801,-1.394%,265958496.00,Canada,,5299,,
PROK,ProKidney Corp. Class A Ordinary Shares,$10.95,-0.05,-0.455%,2543292902.00,United States,2021,81813,Health Care,Biotechnology: Biological Products (No Diagnostic Substances)
PROV,Provident Financial Holdings Inc. Common Stock,$14.715,0.155,1.065%,104951353.00,United States,,2008,Finance,Savings Institutions
PRPH,ProPhase Labs Inc. Common Stock (DE),$8.06,0.17,2.155%,137740612.00,United States,,24177,Health Care,Biotechnology: Pharmaceutical Preparations
PRPL,Purple Innovation Inc. Common Stock,$5.52,-0.30,-5.155%,504474003.00,United States,2015,306887,Consumer Discretionary,Home Furnishings
PRPO,Precipio Inc.  Common Stock,$0.9101,0.0092,1.021%,20768719.00,United States,,25026,Industrials,Biotechnology: Laboratory Analytical Instruments
PRQR,ProQR Therapeutics N.V. Ordinary Shares,$3.0027,0.1027,3.541%,214496745.00,Netherlands,2014,360762,Health Care,Biotechnology: Pharmaceutical Preparations
PRSO,Peraso Inc. Common Stock,$0.9402,-0.0798,-7.824%,21794577.00,United States,,33686,Technology,Semiconductors
PRSR,Prospector Capital Corp. Class A Ordinary Shares,$10.05,-0.025,-0.248%,103706513.00,United States,2021,5145,Finance,Business Services
PRSRU,Prospector Capital Corp. Unit,$10.06,-0.02,-0.198%,0.00,United States,2021,4219,Finance,Business Services
PRSRW,Prospector Capital Corp. Warrants,$0.0671,-0.018,-21.152%,0.00,United States,2021,4250,Finance,Business Services
PRST,Presto Automation Inc. Common Stock,$3.84,-0.14,-3.518%,196258291.00,United States,2021,29304,Technology,EDP Services
PRSTW,Presto Automation Inc. Warrant,$0.1649,0.0031,1.916%,0.00,United States,2021,10520,Technology,EDP Services
PRTA,Prothena Corporation plc Ordinary Shares,$56.30,-1.97,-3.381%,2906575666.00,United States,,142813,Health Care,Biotechnology: Pharmaceutical Preparations
PRTC,PureTech Health plc American Depositary Shares,$33.39,0.00,0.00%,930951298.00,United States,,21,Finance,Investment Managers
PRTG,Portage Biotech Inc. Common Stock,$4.35,-0.12,-2.685%,74234399.00,Canada,,51967,Energy,Oil & Gas Production
PRTH,Priority Technology Holdings Inc. Common Stock,$4.60,-0.02,-0.433%,349610893.00,United States,2016,13661,Technology,EDP Services
PRTK,Paratek Pharmaceuticals Inc. Common Stock,$2.12,-0.03,-1.395%,117764868.00,United States,,83785,Health Care,Biotechnology: Pharmaceutical Preparations
PRTS,CarParts.com Inc. Common Stock,$6.505,-0.095,-1.439%,354909548.00,United States,2007,446712,Consumer Discretionary,Auto & Home Supply Stores
PRVA,Privia Health Group Inc. Common Stock,$25.54,-0.28,-1.084%,2919184865.00,United States,2021,432731,Technology,Retail: Computer Software & Peripheral Equipment
PRVB,Provention Bio Inc. Common Stock,$9.255,0.165,1.815%,806949623.00,United States,2018,547686,Health Care,Biotechnology: Pharmaceutical Preparations
PSEC,Prospect Capital Corporation Common Stock,$7.505,0.045,0.603%,2984156667.00,United States,2004,761508,Finance,Finance/Investors Services
PSHG,Performance Shipping Inc. Common Shares,$3.02,0.03,1.003%,13044636.00,Greece,,41824,Consumer Discretionary,Marine Transportation
PSMT,PriceSmart Inc. Common Stock,$74.33,0.09,0.121%,2308014661.00,United States,,58240,Consumer Discretionary,Department/Specialty Retail Stores
PSNL,Personalis Inc. Common Stock,$4.02,0.14,3.608%,184804847.00,United States,2019,528488,Health Care,Biotechnology: In Vitro & In Vivo Diagnostic Substances
PSNY,Polestar Automotive Holding UK PLC Class A ADS,$5.875,-0.055,-0.927%,12392598964.00,Sweden,,1065533,Consumer Discretionary,Auto Manufacturing
PSNYW,Polestar Automotive Holding UK PLC Class C-1 ADS (ADW),$1.0999,0.0399,3.764%,2320105464.00,Sweden,,82478,Consumer Discretionary,Auto Manufacturing
PSTV,PLUS THERAPEUTICS Inc. Common Stock ,$0.3998,0.0058,1.472%,13433829.00,United States,,91491,Health Care,Medical/Dental Instruments
PSTX,Poseida Therapeutics Inc. Common Stock,$8.50,0.25,3.03%,730569773.00,United States,2020,308266,Health Care, Medicinal Chemicals and Botanical Products 
PT,Pintec Technology Holdings Limited American Depositary Shares,$0.444,-0.006,-1.333%,3853014.00,China,2018,117364,Technology,Computer Software: Programming Data Processing
PTC,PTC Inc. Common Stock,$134.79,3.44,2.619%,15925994104.00,United States,,463523,Technology,Computer Software: Prepackaged Software
PTCT,PTC Therapeutics Inc. Common Stock,$45.86,-0.37,-0.80%,3346740537.00,United States,2013,148801,Health Care,Biotechnology: Pharmaceutical Preparations
PTE,PolarityTE Inc. Common Stock,$0.80,-0.01,-1.235%,5805429.00,United States,,20949,Health Care, Medicinal Chemicals and Botanical Products 
PTEN,Patterson-UTI Energy Inc. Common Stock,$16.22,0.22,1.375%,3516848461.00,United States,1993,1978346,Energy,Oil & Gas Production
PTGX,Protagonist Therapeutics Inc. Common Stock,$15.80,0.84,5.615%,777334894.00,United States,2016,858442,Health Care,Biotechnology: Pharmaceutical Preparations
PTIX,Protagenic Therapeutics Inc. Common Stock,$0.56,-0.0042,-0.744%,9679746.00,United States,,9114,Health Care,Biotechnology: Pharmaceutical Preparations
PTIXW,Protagenic Therapeutics Inc. Warrant,$0.07,0.00,0.00%,0.00,United States,,2,Health Care,Biotechnology: Pharmaceutical Preparations
PTLO,Portillo's Inc. Class A Common Stock,$22.87,0.32,1.419%,1104682703.00,United States,2021,589101,Consumer Discretionary,Restaurants
PTMN,Portman Ridge Finance Corporation Common Stock,$22.615,-0.185,-0.811%,217305567.00,United States,2006,8366,Finance,Finance/Investors Services
PTNR,Partner Communications Company Ltd. American Depositary Shares,$6.73,0.1046,1.579%,1253472454.00,Israel,,19095,Telecommunications,Telecommunications Equipment
PTOC,Pine Technology Acquisition Corp. Class A Common Stock,$10.12,0.00,0.00%,436425000.00,United States,2021,53000,Industrials,Consumer Electronics/Appliances
PTOCU,Pine Technology Acquisition Corp. Unit,$10.13,0.00,0.00%,0.00,United States,2021,1,Industrials,Consumer Electronics/Appliances
PTOCW,Pine Technology Acquisition Corp. Warrant,$0.02,0.002,11.111%,0.00,United States,2021,21900,Industrials,Consumer Electronics/Appliances
PTON,Peloton Interactive Inc. Class A Common Stock,$15.7701,-0.0199,-0.126%,5456773960.00,United States,2019,8710692,Consumer Discretionary,Other Consumer Services
PTPI,Petros Pharmaceuticals Inc. Common Stock,$2.8866,0.0866,3.093%,5977580.00,United States,,13873,Health Care,Biotechnology: Pharmaceutical Preparations
PTRA,Proterra Inc. Common Stock,$5.04,-0.06,-1.176%,1136765730.00,United States,2020,998889,Consumer Discretionary,Auto Manufacturing
PTRS,Partners Bancorp Common Stock,$9.00,-0.14,-1.532%,161655291.00,United States,,14362,Finance,Major Banks
PTSI,P.A.M. Transportation Services Inc. Common Stock,$29.00,1.01,3.608%,643424827.00,United States,1986,12460,Industrials,Trucking Freight/Courier Services
PTVE,Pactiv Evergreen Inc. Common stock,$11.21,-0.26,-2.267%,1993172325.00,United States,2020,70210,Consumer Discretionary,Containers/Packaging
PTWO,Pono Capital Two Inc. Class A Common Stock,$10.30,-0.01,-0.097%,155188813.00,United States,2022,41890,Industrials,Consumer Electronics/Appliances
PTWOU,Pono Capital Two Inc. Unit,$10.42,0.00,0.00%,0.00,United States,2022,109,Industrials,Consumer Electronics/Appliances
PTWOW,Pono Capital Two Inc. Warrants,$0.0702,-0.0007,-0.987%,0.00,United States,2022,1322,Industrials,Consumer Electronics/Appliances
PUBM,PubMatic Inc. Class A Common Stock,$16.09,0.18,1.131%,769528449.00,United States,2020,198326,Technology,Computer Software: Prepackaged Software
PUCK,Goal Acquisitions Corp. Common Stock,$10.16,-0.02,-0.196%,336918300.00,United States,2021,3618,Industrials,Consumer Electronics/Appliances
PUCKU,Goal Acquisitions Corp. Unit,$10.2999,0.1299,1.277%,0.00,United States,2021,291,Industrials,Consumer Electronics/Appliances
PUCKW,Goal Acquisitions Corp. Warrant,$0.0495,0.0005,1.02%,0.00,United States,2021,3130,Industrials,Consumer Electronics/Appliances
PULM,Pulmatrix Inc. Common Stock,$3.90,-0.0657,-1.657%,14192822.00,United States,2014,10333,Health Care,Biotechnology: Pharmaceutical Preparations
PUYI,Puyi Inc. American Depository Shares,$6.26,0.00,0.00%,377569872.00,China,2019,31,Finance,Investment Managers
PVBC,Provident Bancorp Inc. (MD) Common Stock,$8.98,-0.04,-0.443%,158673888.00,United States,2015,92751,Finance,Major Banks
PWFL,PowerFleet Inc. Common Stock,$2.78,0.08,2.963%,100555205.00,United States,,23517,Telecommunications,Telecommunications Equipment
PWOD,Penns Woods Bancorp Inc. Common Stock,$26.65,0.05,0.188%,188057990.00,United States,,6654,Finance,Major Banks
PWP,Perella Weinberg Partners Class A Common Stock,$10.335,-0.365,-3.411%,1018003505.00,United States,2020,121879,Finance,Investment Bankers/Brokers/Service
PWUP,PowerUp Acquisition Corp. Class A Ordinary Shares,$10.41,0.02,0.192%,374109375.00,United States,2022,28001,Finance,Business Services
PWUPU,PowerUp Acquisition Corp. Unit,$10.4001,0.0001,0.001%,0.00,United States,2022,1100,Finance,Business Services
PWUPW,PowerUp Acquisition Corp. Warrant,$0.1099,0.0099,9.90%,0.00,United States,2022,133,Finance,Business Services
PXLW,Pixelworks Inc.  Common Stock,$2.1701,0.0001,0.005%,119043090.00,United States,2000,85046,Technology,Semiconductors
PXMD,PaxMedica Inc. Common Stock,$3.46,0.11,3.284%,41643148.00,United States,2022,416601,Health Care, Medicinal Chemicals and Botanical Products 
PXS,Pyxis Tankers Inc. Common Stock,$5.00,0.19,3.95%,107799425.00,Greece,,90426,Consumer Discretionary,Marine Transportation
PXSAP,Pyxis Tankers Inc. 7.75% Series A Cumulative Convertible Preferred Shares,$23.60,-0.4001,-1.667%,0.00,Greece,,1578,Consumer Discretionary,Marine Transportation
PXSAW,Pyxis Tankers Inc. Warrant,$1.20,-0.18,-13.043%,0.00,Greece,,7199,Consumer Discretionary,Marine Transportation
PYCR,Paycor HCM Inc. Common Stock,$25.40,0.03,0.118%,4466742248.00,United States,2021,284113,Technology,Computer Software: Prepackaged Software
PYPD,PolyPid Ltd. Ordinary Shares,$0.827,0.0103,1.261%,16255188.00,Israel,2020,51551,Health Care,Medical/Dental Instruments
PYPL,PayPal Holdings Inc. Common Stock,$82.27,-0.06,-0.073%,93790081512.00,United States,,7758395,Consumer Discretionary,Business Services
PYR,PyroGenesis Canada Inc. Common Shares,$1.00,-0.13,-11.504%,173540395.00,Canada,,46951,,
PYXS,Pyxis Oncology Inc. Common Stock,$1.62,0.02,1.25%,56857555.00,United States,2021,6527,Health Care,Biotechnology: Pharmaceutical Preparations
PZZA,Papa John's International Inc. Common Stock,$91.85,1.06,1.168%,3244890853.00,United States,1993,262932,Consumer Discretionary,Restaurants
QCOM,QUALCOMM Incorporated Common Stock,$135.95,3.02,2.272%,151584250000.00,United States,1991,4037756,Technology,Computer peripheral equipment
QCRH,QCR Holdings Inc. Common Stock,$53.81,0.33,0.617%,903789639.00,United States,,30302,Finance,Major Banks
QDEL,QuidelOrtho Corporation Common Stock,$89.40,0.15,0.168%,5904455005.00,United States,,218489,Health Care,Medical/Dental Instruments
QFIN,360 DigiTech Inc. American Depositary Shares,$22.10,0.10,0.455%,3523764357.00,China,2018,337876,Finance,Finance: Consumer Services
QH,Quhuo Limited American Depository Shares,$1.72,0.23,15.436%,10608308.00,China,2020,321428,Consumer Discretionary,Business Services
QIPT,Quipt Home Medical Corp. Common Shares,$6.01,0.06,1.008%,211789461.00,United States,,39880,,
QLGN,Qualigen Therapeutics Inc. Common Stock,$1.3607,-0.0193,-1.399%,5729550.00,United States,2015,24004,Health Care,Biotechnology: Commercial Physical & Biological Resarch
QLI,Qilian International Holding Group Ltd. Ordinary Shares,$1.40,-0.01,-0.709%,50050000.00,China,2021,5028,Health Care,Biotechnology: Pharmaceutical Preparations
QLYS,Qualys Inc. Common Stock,$123.21,2.19,1.81%,4680505053.00,United States,2012,187008,Technology,EDP Services
QMCO,Quantum Corporation Common Stock,$1.5439,-0.1061,-6.43%,162440881.00,United States,,66836,Technology,Electronic Components
QNCX,Quince Therapeutics Inc. Common Stock,$1.00,-0.03,-2.913%,36130306.00,United States,2019,190626,Health Care,Biotechnology: Biological Products (No Diagnostic Substances)
QNRX,Quoin Pharmaceuticals Ltd. American Depositary Shares,$2.21,-0.21,-8.678%,10710995.00,Israel,2016,122119,Health Care,Medical/Dental Instruments
QNST,QuinStreet Inc. Common Stock,$14.90,-0.50,-3.247%,799241185.00,United States,2010,385652,Consumer Discretionary,Advertising
QOMO,Qomolangma Acquisition Corp. Common Stock,$10.20,0.00,0.00%,67193755.00,United States,2022,1,Industrials,Consumer Electronics/Appliances
QOMOR,Qomolangma Acquisition Corp. Right,$0.1201,0.01,9.083%,0.00,United States,2022,28519,,
QQQX,Nuveen NASDAQ 100 Dynamic Overwrite Fund Shares of Beneficial Interest,$23.225,0.285,1.242%,1092024195.00,United States,,69009,Finance,Finance Companies
QRHC,Quest Resource Holding Corporation Common Stock,$7.2502,0.0302,0.418%,143231406.00,United States,,13909,Consumer Discretionary,Building Products
QRTEA,Qurate Retail Inc. Series A Common Stock ,$2.52,-0.02,-0.787%,963173333.00,United States,,5394909,Consumer Discretionary,Catalog/Specialty Distribution
QRTEB,Qurate Retail Inc. Series B Common Stock ,$5.16,-0.23,-4.267%,1972212062.00,United States,,5406,Consumer Discretionary,Catalog/Specialty Distribution
QRTEP,Qurate Retail Inc. 8.0% Fixed Rate Cumulative Redeemable Preferred Stock,$50.7749,-1.1951,-2.30%,0.00,United States,,40699,Consumer Discretionary,Catalog/Specialty Distribution
QRVO,Qorvo Inc. Common Stock,$109.00,6.76,6.612%,10887923890.00,United States,,1224620,Industrials,Industrial Machinery/Components
QSG,QuantaSing Group Limited American Depositary Shares,$12.19,-0.29,-2.324%,671410036.00,China,2023,21699,Real Estate,Other Consumer Services
QSI,Quantum-Si Incorporated Class A Common Stock,$2.32,-0.04,-1.695%,324380068.00,United States,2020,183774,Health Care,Biotechnology: Pharmaceutical Preparations
QSIAW,Quantum-Si Incorporated Warrant,$0.4625,-0.0375,-7.50%,0.00,United States,2020,250,Health Care,Biotechnology: Pharmaceutical Preparations
QTEK,QualTek Services Inc. Class A Common Stock,$0.4598,0.0055,1.211%,12785042.00,United States,2021,24144,Consumer Discretionary,Telecommunications Equipment
QTEKW,QualTek Services Inc. Warrant,$0.0278,-0.0065,-18.95%,0.00,United States,2021,63572,Consumer Discretionary,Telecommunications Equipment
QTRX,Quanterix Corporation Common Stock,$14.37,-0.52,-3.492%,532476111.00,United States,2017,99538,Health Care,Industrial Specialties
QTT,Qutoutiao Inc. American Depositary Shares,$0.923,0.011,1.206%,26735935.00,China,2018,45553,Technology,Computer Software: Prepackaged Software
QUBT,Quantum Computing Inc. Common Stock,$1.955,-0.155,-7.346%,104205029.00,United States,,981869,Technology,Computer Manufacturing
QUIK,QuickLogic Corporation Common Stock,$5.90,-0.055,-0.924%,77363986.00,United States,1999,12361,Technology,Semiconductors
QUMU,Qumu Corporation Common Stock,$0.8925,-0.0074,-0.822%,16005029.00,United States,,6210,Technology,Retail: Computer Software & Peripheral Equipment
QURE,uniQure N.V. Ordinary Shares,$22.62,0.15,0.668%,1058957766.00,Netherlands,2014,178736,Health Care,Biotechnology: Pharmaceutical Preparations
RADI,Radius Global Infrastructure Inc. Class A Common Stock,$13.83,0.03,0.217%,1317771676.00,United States,,658393,Consumer Discretionary,Telecommunications Equipment
RAIL,FreightCar America Inc. Common Stock,$3.69,0.07,1.934%,63553999.00,United States,2005,49198,Industrials,Railroads
RAIN,Rain Oncology Inc. Common Stock,$10.41,0.16,1.561%,365819434.00,United States,2021,126668,Health Care,Biotechnology: Pharmaceutical Preparations
RAM,Aries I Acquisition Corporation Class A Ordinary Share,$10.44,0.00,0.00%,61489596.00,Cayman Islands,2021,2318,Finance,Business Services
RAMMU,Aries I Acquisition Corporation Unit,$10.5099,0.1099,1.057%,0.00,Cayman Islands,2021,3870,Finance,Business Services
RAMMW,Aries I Acquisition Corporation Warrant,$0.0579,0.0139,31.591%,0.00,Cayman Islands,2021,603,Finance,Business Services
RAND,Rand Capital Corporation Common Stock,$13.91,0.00,0.00%,35902002.00,United States,,46,Finance,Finance/Investors Services
RANI,Rani Therapeutics Holdings Inc. Class A Common Stock,$5.6918,-0.1582,-2.704%,287682008.00,United States,2021,31680,Health Care, Medicinal Chemicals and Botanical Products 
RAPT,RAPT Therapeutics Inc. Common Stock,$28.05,0.84,3.087%,952715641.00,United States,2019,195350,Health Care,Biotechnology: Pharmaceutical Preparations
RARE,Ultragenyx Pharmaceutical Inc. Common Stock,$46.95,1.01,2.199%,3291460455.00,United States,2014,276530,Health Care,Biotechnology: Pharmaceutical Preparations
RAVE,Rave Restaurant Group Inc. Common Stock,$1.5823,-0.0477,-2.926%,22396591.00,United States,,20562,Consumer Discretionary,Restaurants
RAYA,Erayak Power Solution Group Inc. Class A Ordinary Shares,$3.0943,-0.2357,-7.078%,37131600.00,China,2022,47561,,
RBB,RBB Bancorp Common Stock,$20.54,0.05,0.244%,389557039.00,United States,2017,7098,Finance,Commercial Banks
RBBN,Ribbon Communications Inc. Common Stock,$3.80,-0.06,-1.554%,638867677.00,United States,,165761,Technology,EDP Services
RBCAA,Republic Bancorp Inc. Class A Common Stock,$46.14,0.02,0.043%,911118967.00,United States,1998,6339,Finance,Major Banks
RBKB,Rhinebeck Bancorp Inc. Common Stock,$9.30,-0.06,-0.641%,104946455.00,United States,2019,1110,Finance,Major Banks
RCAC,Revelstone Capital Acquisition Corp. Class A Common Stock,$10.16,0.005,0.049%,209550000.00,United States,2022,202,Industrials,Consumer Electronics/Appliances
RCACU,Revelstone Capital Acquisition Corp. Unit,$10.17,0.00,0.00%,209756250.00,United States,2021,1,Industrials,Consumer Electronics/Appliances
RCACW,Revelstone Capital Acquisition Corp. Warrant,$0.0816,0.00,0.00%,0.00,United States,2022,61,Industrials,Consumer Electronics/Appliances
RCAT,Red Cat Holdings Inc. Common Stock,$1.279,-0.131,-9.291%,69472361.00,United States,,181151,Industrials,Wholesale Distributors
RCEL,Avita Medical Inc. Common Stock,$9.70,0.12,1.253%,242799749.00,United States,,65956,Health Care,Medical Specialities
RCII,Rent-A-Center Inc. Common Stock,$29.00,-0.16,-0.549%,1614431392.00,United States,1995,313141,Consumer Discretionary,Diversified Commercial Services
RCKT,Rocket Pharmaceuticals Inc. Common Stock,$20.835,0.495,2.434%,1640319132.00,United States,2015,400217,Health Care,Biotechnology: Pharmaceutical Preparations
RCKY,Rocky Brands Inc. Common Stock,$29.72,-0.70,-2.301%,217740935.00,United States,1993,22256,Consumer Discretionary,Shoe Manufacturing
RCLF,Rosecliff Acquisition Corp I Class A Common Stock,$10.19,0.00,0.00%,322258750.00,United States,2021,1,Industrials,Consumer Electronics/Appliances
RCLFU,Rosecliff Acquisition Corp I Unit,$10.11,0.00,0.00%,0.00,United States,2021,74,Industrials,Consumer Electronics/Appliances
RCLFW,Rosecliff Acquisition Corp I Warrants,$0.0703,0.0002,0.285%,0.00,United States,2021,20956,Industrials,Consumer Electronics/Appliances
RCM,R1 RCM Inc. Common Stock,$14.025,-0.085,-0.602%,5841564783.00,United States,,1191514,Consumer Discretionary,Other Consumer Services
RCMT,RCM Technologies Inc. Common Stock,$13.45,0.03,0.224%,132371726.00,United States,,34354,Industrials,Consumer Electronics/Appliances
RCON,Recon Technology Ltd. Class A Ordinary Shares,$1.7069,0.0669,4.079%,12294514.00,China,2009,603273,Energy,Oilfield Services/Equipment
RCRT,Recruiter.com Group Inc. Common Stock,$0.691,-0.0589,-7.854%,11247935.00,United States,,1081446,Technology,Interactive Media
RCRTW,Recruiter.com Group Inc. Warrant,$0.07,-0.0034,-4.632%,0.00,United States,,558,Technology,Interactive Media
RDCM,Radcom Ltd. Ordinary Shares,$10.55,0.045,0.428%,152825085.00,Israel,1997,17562,Technology,Computer peripheral equipment
RDFN,Redfin Corporation Common Stock,$8.84,-1.04,-10.526%,961338667.00,United States,2017,4912446,Finance,Real Estate
RDHL,Redhill Biopharma Ltd. American Depositary Shares,$0.2301,-0.0289,-11.158%,20986048.00,Israel,,6037271,Health Care,Biotechnology: Pharmaceutical Preparations
RDI,Reading International Inc Class A Common Stock,$3.66,-0.05,-1.348%,80680396.00,United States,,5535,Consumer Discretionary,Movies/Entertainment
RDIB,Reading International Inc Class B Common Stock,$19.65,-0.86,-4.193%,433161142.00,United States,,1081,Consumer Discretionary,Movies/Entertainment
RDNT,RadNet Inc. Common Stock,$21.29,0.25,1.188%,1221212497.00,United States,,69223,Health Care,Medical Specialities
RDVT,Red Violet Inc. Common Stock ,$23.60,-0.47,-1.953%,327893751.00,United States,,18580,Technology,Computer Software: Prepackaged Software
RDWR,Radware Ltd. Ordinary Shares,$22.06,0.26,1.193%,989187364.00,Israel,1999,55297,Technology,EDP Services
REAL,The RealReal Inc. Common Stock,$1.86,-0.05,-2.618%,182402351.00,United States,2019,2794497,Consumer Discretionary,Consumer Specialties
REAX,The Real Brokerage Inc. Common Shares,$1.3803,-0.0497,-3.476%,246869191.00,Canada,,94733,,
REBN,Reborn Coffee Inc. Common Stock,$1.0524,-0.0166,-1.553%,13806986.00,United States,2022,15406,Consumer Discretionary,Restaurants
REE,REE Automotive Ltd. Class A Ordinary Shares,$0.491,-0.0154,-3.041%,119681536.00,Israel,,212987,Consumer Discretionary,Auto Manufacturing
REED,Reeds Inc. Common Stock,$3.7621,-0.3579,-8.687%,9483490.00,United States,,10978,Consumer Staples,Beverages (Production/Distribution)
REFI,Chicago Atlantic Real Estate Finance Inc. Common Stock,$15.29,0.02,0.131%,269989490.00,United States,2021,172311,Real Estate,Real Estate Investment Trusts
REFR,Research Frontiers Incorporated Common Stock,$2.05,-0.02,-0.966%,67958312.00,United States,,5747,Technology,Industrial Machinery/Components
REG,Regency Centers Corporation Common Stock,$65.74,-0.46,-0.695%,11249607613.00,United States,1993,551525,Real Estate,Real Estate Investment Trusts
REGN,Regeneron Pharmaceuticals Inc. Common Stock,$771.50,-9.36,-1.199%,84017842853.00,United States,1991,501779,Health Care,Biotechnology: Pharmaceutical Preparations
REKR,Rekor Systems Inc. Common Stock,$1.75,-0.09,-4.891%,95108214.00,United States,,790097,Technology,EDP Services
RELI,Reliance Global Group Inc. Common Stock,$0.6411,-0.0279,-4.17%,11574720.00,United States,,210519,Finance,Specialty Insurers
RELIW,Reliance Global Group Inc. Series A Warrants,$0.121,-0.021,-14.789%,0.00,United States,,300,Finance,Specialty Insurers
RELL,Richardson Electronics Ltd. Common Stock,$23.95,0.24,1.012%,337088682.00,United States,1983,48734,Technology,Electronic Components
RELY,Remitly Global Inc. Common Stock,$12.57,-0.11,-0.868%,2145244004.00,United States,2021,207396,Technology,Computer Software: Prepackaged Software
RENE,Cartesian Growth Corporation II Class A Ordinary Shares,$10.35,-0.01,-0.097%,297562500.00,United States,2022,103,Finance,Business Services
RENT,Rent the Runway Inc. Class A Common Stock,$4.35,-0.16,-3.548%,282849123.00,United States,2021,467656,Consumer Discretionary,Department/Specialty Retail Stores
REPL,Replimune Group Inc. Common Stock,$28.32,0.16,0.568%,1560825450.00,United States,2018,81902,Health Care,Biotechnology: Pharmaceutical Preparations
RETA,Reata Pharmaceuticals Inc. Class A Common Stock,$49.315,-0.365,-0.735%,1807081846.00,United States,2016,454568,Health Care,Biotechnology: Pharmaceutical Preparations
