Symbol,Name,Last Sale,Net Change,% Change,Market Cap,Country,IPO Year,Volume,Sector,Industry
ISTR,Investar Holding Corporation Common Stock,$20.63,0.01,0.048%,204275104.00,United States,2014,9896,Finance,Commercial Banks
ISUN,iSun Inc. Common Stock,$1.805,-0.055,-2.957%,27777241.00,United States,2016,68450,Technology,Semiconductors
ITAQ,Industrial Tech Acquisitions II Inc. Class A Common Stock,$10.27,0.00,0.00%,221446875.00,United States,2022,1,Industrials,Consumer Electronics/Appliances
ITAQU,Industrial Tech Acquisitions II Inc. Unit,$10.30,0.00,0.00%,0.00,United States,2022,200,Industrials,Consumer Electronics/Appliances
ITAQW,Industrial Tech Acquisitions II Inc. Warrants,$0.0662,-0.0348,-34.455%,0.00,United States,2022,1551,Industrials,Consumer Electronics/Appliances
ITCI,Intra-Cellular Therapies Inc. Common Stock,$47.35,-0.17,-0.358%,4484284307.00,United States,,282721,Health Care,Biotechnology: Pharmaceutical Preparations
ITI,Iteris Inc. Common Stock,$4.69,0.11,2.402%,200611293.00,United States,,173143,Telecommunications,Telecommunications Equipment
ITIC,Investors Title Company Common Stock,$158.48,1.94,1.239%,300633707.00,United States,,521,Finance,Specialty Insurers
ITOS,iTeos Therapeutics Inc. Common Stock,$20.79,0.41,2.012%,739610965.00,United States,2020,76856,Health Care, Medicinal Chemicals and Botanical Products 
ITQ,Itiquira Acquisition Corp. Class A Ordinary Shares,$10.16,0.01,0.099%,292100000.00,United States,2021,87238,Finance,Business Services
ITQRU,Itiquira Acquisition Corp. Unit,$10.15,0.00,0.00%,0.00,United States,2021,123,Finance,Business Services
ITQRW,Itiquira Acquisition Corp. Warrant,$0.0033,0.0003,10.00%,0.00,United States,2021,11100,Finance,Business Services
ITRI,Itron Inc. Common Stock,$58.245,0.165,0.284%,2631392202.00,United States,1993,150549,Industrials,Electrical Products
ITRM,Iterum Therapeutics plc Ordinary Share,$1.46,0.00,0.00%,17860726.00,Ireland,2018,37380,Health Care,Biotechnology: Pharmaceutical Preparations
ITRN,Ituran Location and Control Ltd. Ordinary Shares,$22.185,-0.265,-1.18%,449628475.00,Israel,2005,5471,Technology,Electronic Components
IVA,Inventiva S.A. American Depository Shares,$6.215,-0.035,-0.56%,261863860.00,France,2020,1115,Consumer Discretionary,Other Consumer Services
IVAC,Intevac Inc. Common Stock,$6.95,0.00,0.00%,176812559.00,United States,1995,123298,Technology,Industrial Machinery/Components
IVCA,Investcorp India Acquisition Corp. Class A Ordinary Share,$10.41,-0.01,-0.096%,336698438.00,Cayman Islands,2022,100400,Finance,Business Services
IVCAU,Investcorp India Acquisition Corp. Unit,$10.46,0.00,0.00%,0.00,Cayman Islands,2022,1250,Finance,Business Services
IVCAW,Investcorp India Acquisition Corp. Warrant,$0.0533,-0.0477,-47.228%,0.00,Cayman Islands,2022,1096,Finance,Business Services
IVCB,Investcorp Europe Acquisition Corp I Class A Ordinary Shares,$10.37,0.00,0.00%,447206250.00,Cayman Islands,2022,1,Finance,Business Services
IVCBU,Investcorp Europe Acquisition Corp I Unit,$10.3501,0.00,0.00%,0.00,Cayman Islands,2021,7,Finance,Business Services
IVCBW,Investcorp Europe Acquisition Corp I Warrant,$0.0394,0.0094,31.333%,0.00,Cayman Islands,2022,38900,Finance,Business Services
IVCP,Swiftmerge Acquisition Corp. Class A Ordinary Share,$10.22,0.00,0.00%,287437500.00,United States,2022,131,Finance,Business Services
IVCPW,Swiftmerge Acquisition Corp. Warrants,$0.0803,0.00,0.00%,0.00,United States,2022,10,Finance,Business Services
IVDA,Iveda Solutions Inc. Common Stock,$1.76,0.08,4.762%,26341461.00,United States,,4553837,Technology,Security Systems Services
IVDAW,Iveda Solutions Inc. Warrant,$0.4393,-0.0607,-12.14%,0.00,United States,,8823,Technology,Security Systems Services
IVVD,Invivyd Inc. Common Stock,$2.00,-0.02,-0.99%,217964802.00,United States,2021,210071,Health Care,Biotechnology: Pharmaceutical Preparations
IXAQ,IX Acquisition Corp. Class A Ordinary Share,$10.22,-0.01,-0.098%,293825000.00,United Kingdom,2021,2196,Finance,Business Services
IXAQW,IX Acquisition Corp. Warrant,$0.0233,0.0023,10.952%,0.00,United Kingdom,2021,26461,Finance,Business Services
IXHL,Incannex Healthcare Limited American Depositary Shares,$3.3878,0.1878,5.869%,206465226.00,Australia,,802,,
IZEA,IZEA Worldwide Inc. Common Stock,$0.734,-0.0339,-4.415%,45746612.00,United States,,47979,Consumer Discretionary,Advertising
JACK,Jack In The Box Inc. Common Stock,$78.30,-0.45,-0.571%,1612806096.00,United States,,135931,Consumer Discretionary,Restaurants
JAGX,Jaguar Health Inc. Common Stock,$4.4602,-0.0698,-1.541%,8993369.00,United States,2015,215397,Health Care,Biotechnology: Pharmaceutical Preparations
JAKK,JAKKS Pacific Inc. Common Stock,$20.95,-0.02,-0.095%,203708037.00,United States,1996,38410,Consumer Discretionary,Recreational Games/Products/Toys
JAMF,Jamf Holding Corp. Common Stock,$21.64,0.32,1.501%,2626821973.00,United States,2020,96762,Technology,Computer Software: Prepackaged Software
JAN,JanOne Inc. Common Stock (NV),$1.7899,0.0449,2.573%,5638597.00,United States,,43995,Utilities,Environmental Services
JANX,Janux Therapeutics Inc. Common Stock,$20.785,-0.495,-2.326%,865966058.00,United States,2021,47348,Health Care,Biotechnology: Pharmaceutical Preparations
JAQC,Jupiter Acquisition Corporation Common stock,$10.00,-0.02,-0.20%,202975490.00,United States,2021,318,Industrials,Consumer Electronics/Appliances
JAZZ,Jazz Pharmaceuticals plc Common Stock (Ireland),$152.04,-1.09,-0.712%,9573399293.00,Ireland,2007,207155,Health Care,Biotechnology: Pharmaceutical Preparations
JBHT,J.B. Hunt Transport Services Inc. Common Stock,$199.10,2.02,1.025%,20655231300.00,United States,,298429,Industrials,Trucking Freight/Courier Services
JBLU,JetBlue Airways Corporation Common Stock,$8.74,0.11,1.275%,2830690346.00,United States,2002,4950633,Consumer Discretionary,Air Freight/Delivery Services
JBSS,John B. Sanfilippo & Son Inc. Common Stock,$92.06,-1.07,-1.149%,1063831735.00,United States,1991,56289,Consumer Staples,Specialty Foods
JCSE,JE Cleantech Holdings Limited Ordinary Shares,$0.72,-0.02,-2.703%,10814400.00,Singapore,2022,15653,Consumer Discretionary,Miscellaneous manufacturing industries
JCTCF,Jewett-Cameron Trading Company Common Shares,$5.445,0.00,0.00%,19051505.00,United States,,178,,
JD,JD.com Inc. American Depositary Shares,$56.53,-0.20,-0.353%,88497715000.00,China,2014,6028824,Consumer Discretionary,Catalog/Specialty Distribution
JEWL,Adamas One Corp. Common Stock,$1.88,-0.25,-11.737%,37886226.00,United States,2022,102490,Consumer Discretionary,Consumer Specialties
JFBR,Jeffs' Brands Ltd Ordinary Shares,$1.02,-0.05,-4.673%,8235701.00,Israel,2022,29618,Miscellaneous,Diversified Commercial Services
JFBRW,Jeffs' Brands Ltd Warrant,$0.131,-0.04,-23.392%,0.00,Israel,2022,2403,Miscellaneous,Diversified Commercial Services
JFIN,Jiayin Group Inc. American Depositary Shares,$3.51,0.08,2.332%,187227830.00,China,2019,12941,Finance,Finance: Consumer Services
JFU,9F Inc. American Depositary Shares,$3.66,-0.5201,-12.442%,42497479.00,China,2019,41997,Finance,Finance: Consumer Services
JG,Aurora Mobile Limited American Depositary Shares,$0.7799,-0.0108,-1.366%,92694709.00,China,2018,21619,Technology,EDP Services
JGGC,Jaguar Global Growth Corporation I Class A Ordinary Shares,$10.3515,-0.0085,-0.082%,317446003.00,United States,2022,3986,Finance,Business Services
JGGCR,Jaguar Global Growth Corporation I Right,$0.12,0.00,0.00%,0.00,United States,2022,87010,Finance,Business Services
JGGCU,Jaguar Global Growth Corporation I Unit,$10.60,0.18,1.727%,0.00,United States,2022,451,Finance,Business Services
JGGCW,Jaguar Global Growth Corporation I Warrant,$0.09,-0.0005,-0.552%,0.00,United States,2022,287041,Finance,Business Services
JJSF,J & J Snack Foods Corp. Common Stock,$143.265,0.945,0.664%,2754889962.00,United States,1986,52795,Consumer Staples,Specialty Foods
JKHY,Jack Henry & Associates Inc. Common Stock,$180.925,3.235,1.821%,13198376166.00,United States,1985,259264,Technology,Retail: Computer Software & Peripheral Equipment
JMAC,Maxpro Capital Acquisition Corp. Class A Common Stock,$10.45,-0.0041,-0.039%,140317636.00,Taiwan,2021,675,Industrials,Consumer Electronics/Appliances
JMACW,Maxpro Capital Acquisition Corp. Warrants,$0.0413,0.0013,3.25%,0.00,Taiwan,2021,11900,Industrials,Consumer Electronics/Appliances
JMSB,John Marshall Bancorp Inc. Common Stock,$27.49,-0.01,-0.036%,387581125.00,United States,,18065,Finance,Major Banks
JNCE,Jounce Therapeutics Inc. Common Stock,$1.195,-0.035,-2.846%,61774613.00,United States,2017,260034,Health Care,Biotechnology: Pharmaceutical Preparations
JOAN,JOANN Inc. Common Stock,$4.43,0.03,0.682%,180686379.00,United States,2021,59215,Consumer Discretionary,Department/Specialty Retail Stores
JOUT,Johnson Outdoors Inc. Class A Common Stock,$66.00,1.32,2.041%,675921642.00,United States,,28445,Consumer Discretionary,Recreational Games/Products/Toys
JRSH,Jerash Holdings (US) Inc. Common Stock,$4.40,0.00,0.00%,54536623.00,United States,2018,9235,Consumer Discretionary,Industrial Specialties
JRVR,James River Group Holdings Ltd. Common Shares,$23.55,0.39,1.684%,882183966.00,Bermuda,2014,50401,Finance,Property-Casualty Insurers
JSM,Navient Corporation 6% Senior Notes due December 15 2043,$20.25,-0.57,-2.738%,0.00,United States,,6515,Finance,Finance: Consumer Services
JSPR,Jasper Therapeutics Inc. Common Stock,$1.885,-0.035,-1.823%,206071714.00,United States,2020,414498,Health Care,Biotechnology: Pharmaceutical Preparations
JSPRW,Japer Therapeutics Inc. Warrants,$0.155,-0.0017,-1.085%,0.00,United States,2020,21313,Health Care,Biotechnology: Pharmaceutical Preparations
JUGG,Jaws Juggernaut Acquisition Corporation Class A Ordinary Share,$10.16,0.02,0.197%,350520000.00,United States,2021,3313,,
JUPW,Jupiter Wellness Inc. Common Stock,$0.6524,0.0024,0.369%,17389510.00,United States,2020,196467,Health Care,Biotechnology: Pharmaceutical Preparations
JUPWW,Jupiter Wellness Inc. Warrant,$0.1001,-0.001,-0.989%,0.00,United States,2020,615,Health Care,Biotechnology: Pharmaceutical Preparations
JVA,Coffee Holding Co. Inc. Common Stock,$2.63,-0.01,-0.379%,15013615.00,United States,2005,4434,Consumer Staples,Specialty Foods
JWAC,Jupiter Wellness Acquisition Corp. Class A Common Stock,$10.30,-0.01,-0.097%,186996500.00,United States,2022,200001,Industrials,Consumer Electronics/Appliances
JWACR,Jupiter Wellness Acquisition Corp. Right,$0.10,0.02,25.00%,0.00,United States,2022,1217,Finance,Business Services
JWEL,Jowell Global Ltd. Ordinary Shares,$0.48,0.0098,2.084%,15114343.00,China,2021,40985,Consumer Discretionary,Other Consumer Services
JXJT,JX Luxventure Limited Common Stock,$0.83,-0.0699,-7.768%,2150778.00,China,2013,33369,Consumer Staples,Apparel
JYNT,The Joint Corp. Common Stock,$17.15,-0.73,-4.083%,249183995.00,United States,2014,47670,,
JZ,Jianzhi Education Technology Group Company Limited American Depositary Shares,$1.77,0.04,2.312%,107182350.00,China,2022,502335,Real Estate,Other Consumer Services
JZXN,Jiuzi Holdings Inc. Ordinary Shares,$0.2143,-0.0179,-7.709%,5509219.00,China,2021,2408702,Consumer Discretionary,Retail-Auto Dealers and Gas Stations
KA,Kineta Inc. Common Stock,$8.31,0.21,2.593%,81116727.00,United States,2016,4068,Health Care,Biotechnology: Pharmaceutical Preparations
KACL,Kairous Acquisition Corp. Limited Ordinary Shares,$10.64,0.00,0.00%,107954962.00,Malaysia,2022,41,Finance,Business Services
KACLR,Kairous Acquisition Corp. Limited Rights,$0.275,0.00,0.00%,0.00,Malaysia,2022,1062,Finance,Business Services
KACLU,Kairous Acquisition Corp. Limited Unit,$10.29,0.00,0.00%,0.00,Malaysia,2021,1,Finance,Business Services
KAII,Kismet Acquisition Two Corp. Class A Ordinary Shares,$10.15,-0.01,-0.098%,360325000.00,United States,2021,61001,Finance,Business Services
KAIIU,Kismet Acquisition Two Corp. Unit,$10.15,-0.0144,-0.142%,0.00,United States,2021,215760,Finance,Business Services
KAIIW,Kismet Acquisition Two Corp. Warrant,$0.0211,0.00,0.00%,0.00,United States,2021,25104,Finance,Business Services
KAL,Kalera Public Limited Company Ordinary Shares,$8.20,-1.07,-11.543%,7533980.00,Ireland,,763657,Consumer Staples,Farming/Seeds/Milling
KALA,Kala Pharmaceuticals Inc. Common Stock,$16.70,0.41,2.517%,936199746.00,United States,2017,44061,Health Care,Biotechnology: Pharmaceutical Preparations
KALU,Kaiser Aluminum Corporation Common Stock,$89.87,0.71,0.796%,1432583969.00,United States,,47813,Industrials,Aluminum
KALV,KalVista Pharmaceuticals Inc. Common Stock,$8.14,0.07,0.867%,277593105.00,United Kingdom,2015,106352,Health Care,Biotechnology: Pharmaceutical Preparations
KALWW,Kalera Public Limited Company Warrant,$0.0486,-0.0064,-11.636%,0.00,Ireland,,1460802,Consumer Staples,Farming/Seeds/Milling
KARO,Karooooo Ltd. Ordinary Shares,$25.006,-0.644,-2.511%,773963357.00,Singapore,2021,7959,Technology,Computer Software: Prepackaged Software
KAVL,Kaival Brands Innovations Group Inc. Common Stock,$0.6921,-0.0379,-5.192%,38874627.00,United States,,175690,Health Care, Medicinal Chemicals and Botanical Products 
KBAL,Kimball International Inc. Class B Common Stock,$7.14,0.03,0.422%,261134833.00,United States,,58740,Consumer Discretionary,Industrial Specialties
KBNT,Kubient Inc. Common Stock,$1.06,-0.11,-9.402%,15266650.00,United States,2020,66408,Technology,EDP Services
KBNTW,Kubient Inc. Warrant,$0.0923,-0.0072,-7.236%,0.00,United States,2020,5300,Technology,EDP Services
KC,Kingsoft Cloud Holdings Limited American Depositary Shares,$4.62,-0.05,-1.071%,1172027717.00,China,2020,1150513,Technology,Computer Software: Prepackaged Software
KDNY,Chinook Therapeutics Inc. Common Stock,$24.47,0.34,1.409%,1564626971.00,United States,2015,243555,Health Care,Biotechnology: Pharmaceutical Preparations
KDP,Keurig Dr Pepper Inc. Common Stock,$34.95,-0.27,-0.767%,49497983180.00,United States,,2813105,Consumer Staples,Beverages (Production/Distribution)
KE,Kimball Electronics Inc. Common Stock,$26.80,1.10,4.28%,662236871.00,United States,,149352,Technology,Industrial Machinery/Components
KELYA,Kelly Services Inc. Class A Common Stock,$18.57,0.02,0.108%,704694769.00,United States,,45209,Consumer Discretionary,Diversified Commercial Services
KELYB,Kelly Services Inc. Class B Common Stock,$18.414,0.00,0.00%,698774877.00,United States,,18,Consumer Discretionary,Diversified Commercial Services
KEQU,Kewaunee Scientific Corporation Common Stock,$16.22,0.00,0.00%,45905844.00,United States,,3,Industrials,Medical Specialities
KERN,Akerna Corp. Common Stock,$1.00,-0.04,-3.846%,14058707.00,United States,2018,108294,Health Care,Managed Health Care
KERNW,Akerna Corp Warrant,$0.0198,-0.0001,-0.503%,0.00,United States,2018,34218,Health Care,Managed Health Care
KFFB,Kentucky First Federal Bancorp Common Stock,$6.85,0.10,1.481%,55859661.00,United States,2005,566,Finance,Savings Institutions
KFRC,Kforce Inc. Common Stock,$58.00,0.50,0.87%,1203711468.00,United States,1995,149451,Consumer Discretionary,Diversified Commercial Services
KHC,The Kraft Heinz Company Common Stock,$39.46,-0.47,-1.177%,48335744271.00,United States,,3238112,Consumer Staples,Farming/Seeds/Milling
KIDS,OrthoPediatrics Corp. Common Stock,$48.00,0.18,0.376%,1098792000.00,United States,2017,29977,Health Care,Medical/Dental Instruments
KINS,Kingstone Companies Inc. Common Stock,$1.59,-0.07,-4.217%,16988353.00,United States,,10946,Finance,Specialty Insurers
KINZ,KINS Technology Group Inc. Class A Common Stock,$10.14,0.00,0.00%,79477320.00,United States,2021,424,Industrials,Consumer Electronics/Appliances
KINZU,KINS Technology Group Inc. Unit,$10.19,0.04,0.394%,0.00,United States,2020,200,Industrials,Consumer Electronics/Appliances
KINZW,KINS Technology Group Inc. Warrant,$0.0658,0.0008,1.231%,0.00,United States,2021,140,Industrials,Consumer Electronics/Appliances
KIRK,Kirkland's Inc. COMMONSTOCK,$3.68,-0.14,-3.665%,46936074.00,United States,2002,137859,Miscellaneous,Diversified Commercial Services
KITT,Nauticus Robotics Inc. Common stock,$3.7177,-0.0023,-0.062%,175664191.00,United States,2021,34224,Industrials,Metal Fabrications
KITTW,Nauticus Robotics Inc. Warrant,$0.23,-0.0226,-8.947%,0.00,United States,2021,4539,Industrials,Metal Fabrications
KLAC,KLA Corporation Common Stock,$412.80,7.21,1.778%,57164446579.00,United States,1980,520716,Technology,Electronic Components
KLIC,Kulicke and Soffa Industries Inc. Common Stock,$55.64,-0.17,-0.305%,3154113588.00,Singapore,,411229,Technology,Semiconductors
KLTR,Kaltura Inc. Common Stock,$2.082,0.002,0.096%,277457445.00,United States,2021,580201,Technology,EDP Services
KLXE,KLX Energy Services Holdings Inc. Common Stock,$13.07,-0.07,-0.533%,160439648.00,United States,,115226,Energy,Oilfield Services/Equipment
KMDA,Kamada Ltd. Ordinary Shares,$4.46,-0.05,-1.109%,199810248.00,Israel,2013,1648,Health Care,Biotechnology: Pharmaceutical Preparations
KMPH,KemPharm Inc. Common Stock,$5.60,0.04,0.719%,193227227.00,United States,,91359,Health Care,Biotechnology: Pharmaceutical Preparations
KNDI,Kandi Technologies Group Inc Common Stock,$2.503,-0.037,-1.457%,185804526.00,China,,101610,Consumer Discretionary,Auto Parts:O.E.M.
KNSA,Kiniksa Pharmaceuticals Ltd. Class A Common Stock,$13.99,-0.25,-1.756%,972749350.00,United States,2018,144614,Health Care,Biotechnology: Pharmaceutical Preparations
KNTE,Kinnate Biopharma Inc. Common Stock,$7.4064,0.0364,0.494%,327101308.00,United States,2020,27092,Health Care,Biotechnology: Pharmaceutical Preparations
KOD,Kodiak Sciences Inc Common Stock,$7.64,-0.34,-4.261%,399641937.00,United States,2018,116929,Health Care,Biotechnology: Pharmaceutical Preparations
KOPN,Kopin Corporation Common Stock,$1.39,-0.01,-0.714%,151682997.00,United States,1992,340538,Technology,Industrial Machinery/Components
KOSS,Koss Corporation Common Stock,$5.76,-0.4398,-7.094%,52933219.00,United States,,82467,Consumer Staples,Consumer Electronics/Appliances
KPLT,Katapult Holdings Inc. Common Stock,$1.09,0.04,3.81%,107308586.00,United States,2019,246074,Technology,EDP Services
KPLTW,Katapult Holdings Inc. Warrant,$0.1398,-0.0001,-0.071%,0.00,United States,2019,100,Technology,EDP Services
KPRX,Kiora Pharmaceuticals Inc.  Common Stock,$4.60,1.32,40.244%,8263771.00,United States,,27532132,Health Care,Biotechnology: In Vitro & In Vivo Diagnostic Substances
KPTI,Karyopharm Therapeutics Inc. Common Stock,$3.415,0.045,1.335%,386622965.00,United States,2013,1330630,Miscellaneous,Diversified Commercial Services
KRBP,Kiromic BioPharma Inc. Common Stock,$0.213,-0.0515,-19.471%,4367501.00,United States,2020,3344478,Health Care, Medicinal Chemicals and Botanical Products 
KRKR,36Kr Holdings Inc. American Depositary Shares,$1.23,0.10,8.85%,49958329.00,China,2019,3745298,Consumer Discretionary,Business Services
KRMD,KORU Medical Systems Inc. Common Stock,$3.87,-0.05,-1.276%,175233399.00,United States,,8832,Health Care,Medical/Dental Instruments
KRNL,Kernel Group Holdings Inc. Class A Ordinary Shares,$10.19,-0.02,-0.196%,388175313.00,United States,2021,18480,Finance,Business Services
KRNLU,Kernel Group Holdings Inc. Units,$10.30,0.08,0.783%,0.00,United States,2021,400,Finance,Business Services
KRNLW,Kernel Group Holdings Inc. Warrants,$0.1201,0.00,0.00%,0.00,United States,2021,5,Finance,Business Services
KRNT,Kornit Digital Ltd. Ordinary Shares,$26.45,-0.83,-3.043%,1320185413.00,Israel,2015,118871,Industrials,Industrial Machinery/Components
KRNY,Kearny Financial Corp Common Stock,$10.11,0.01,0.099%,681292680.00,United States,2005,113963,Finance,Savings Institutions
KRON,Kronos Bio Inc. Common Stock,$2.265,-0.075,-3.205%,128874817.00,United States,2020,80160,Health Care, Medicinal Chemicals and Botanical Products 
KROS,Keros Therapeutics Inc. Common Stock,$54.65,-1.56,-2.775%,1505238667.00,United States,2020,42714,Health Care, Medicinal Chemicals and Botanical Products 
KRT,Karat Packaging Inc. Common Stock,$15.25,-0.04,-0.262%,303597183.00,United States,2021,14741,Industrials,Office Equipment/Supplies/Services
KRTX,Karuna Therapeutics Inc. Common Stock,$192.59,0.44,0.229%,6617927222.00,United States,2019,96525,Health Care,Biotechnology: Pharmaceutical Preparations
KRUS,Kura Sushi USA Inc. Class A Common Stock,$60.77,-1.59,-2.55%,595070536.00,United States,2019,88248,Consumer Discretionary,Restaurants
KRYS,Krystal Biotech Inc. Common Stock,$79.17,-0.78,-0.976%,2038441213.00,United States,2017,63043,Health Care,Biotechnology: Biological Products (No Diagnostic Substances)
KSCP,Knightscope Inc. Class A Common Stock,$1.76,0.14,8.642%,73084128.00,United States,2022,288405,Technology,Security Systems Services
KSI,Kadem Sustainable Impact Corporation Class A common stock,$10.10,0.005,0.05%,220937500.00,United States,2021,101645,Industrials,Consumer Electronics/Appliances
KSICW,Kadem Sustainable Impact Corporation Warrant,$0.05,0.00,0.00%,0.00,United States,2021,15,Industrials,Consumer Electronics/Appliances
KSPN,Kaspien Holdings Inc. Common Stock,$0.7733,-0.0367,-4.531%,3839243.00,United States,,42330,Technology,Retail: Computer Software & Peripheral Equipment
KTCC,Key Tronic Corporation Common Stock,$6.62,0.06,0.915%,71243586.00,United States,1983,10917,Technology,Computer peripheral equipment
KTOS,Kratos Defense & Security Solutions Inc. Common Stock,$11.76,-0.04,-0.339%,1481254167.00,United States,,243105,Consumer Discretionary,Ordnance And Accessories
KTRA,Kintara Therapeutics Inc. Common Stock,$6.78,-0.27,-3.83%,10957470.00,United States,,9169,Health Care,Biotechnology: Pharmaceutical Preparations
KTTA,Pasithea Therapeutics Corp. Common Stock,$0.6813,-0.0162,-2.323%,19927131.00,United States,2021,108116,Health Care,Biotechnology: Pharmaceutical Preparations
KURA,Kura Oncology Inc. Common Stock,$13.05,-0.12,-0.911%,891315000.00,United States,,257734,Health Care,Biotechnology: Biological Products (No Diagnostic Substances)
KVHI,KVH Industries Inc. Common Stock,$9.94,0.08,0.811%,190668643.00,United States,1996,12701,Technology,Radio And Television Broadcasting And Communications Equipment
KVSA,Khosla Ventures Acquisition Co. Class A Common Stock,$10.085,-0.015,-0.149%,408341650.00,United States,2021,6909,Industrials,Consumer Electronics/Appliances
KVSC,Khosla Ventures Acquisition Co. III Class A Common Stock,$10.08,-0.005,-0.05%,632588796.00,United States,2021,147765,Industrials,Consumer Electronics/Appliances
KWE,KWESST Micro Systems Inc. Common Stock,$2.77,-0.08,-2.807%,11281484.00,Canada,,14057,,
KWESW,KWESST Micro Systems Inc. Warrant,$0.3962,-0.0241,-5.734%,0.00,Canada,,1344,,
KXIN,Kaixin Auto Holdings Ordinary Shares,$0.41,-0.0087,-2.078%,80891029.00,China,2017,42086,Consumer Discretionary,Retail-Auto Dealers and Gas Stations
KYCH,Keyarch Acquisition Corporation Ordinary Shares,$10.22,0.005,0.049%,154526400.00,United States,2022,1063653,Finance,Business Services
KYCHU,Keyarch Acquisition Corporation Unit,$10.295,0.00,0.00%,0.00,United States,2022,25,Finance,Business Services
KYCHW,Keyarch Acquisition Corporation Warrant,$0.0676,0.01,17.361%,0.00,United States,2022,544,Finance,Business Services
KYMR,Kymera Therapeutics Inc. Common Stock,$36.37,-0.11,-0.302%,1995430121.00,United States,2020,153577,Health Care, Medicinal Chemicals and Botanical Products 
KZIA,Kazia Therapeutics Limited American Depositary Shares,$0.9885,-0.0215,-2.129%,18664461.00,Australia,,20061,Health Care,Biotechnology: Pharmaceutical Preparations
KZR,Kezar Life Sciences Inc. Common Stock,$6.64,-0.19,-2.782%,454840000.00,United States,2018,127118,Health Care,Biotechnology: Pharmaceutical Preparations
LAB,Standard BioTools Inc. Common Stock,$2.05,0.03,1.485%,162557708.00,United States,2011,58915,Industrials,Biotechnology: Laboratory Analytical Instruments
LABP,Landos Biopharma Inc. Common Stock,$0.3833,-0.0061,-1.567%,15429699.00,United States,2021,60679,Health Care, Medicinal Chemicals and Botanical Products 
LAKE,Lakeland Industries Inc. Common Stock,$14.50,0.04,0.277%,106138347.00,United States,1986,8061,,
LAMR,Lamar Advertising Company Class A Common Stock,$108.22,0.17,0.157%,11004185123.00,United States,1996,206631,Real Estate,Real Estate Investment Trusts
LANC,Lancaster Colony Corporation Common Stock,$183.63,-2.81,-1.507%,5062862730.00,United States,,77213,Consumer Staples,Packaged Foods
LAND,Gladstone Land Corporation Common Stock,$19.1171,-0.2329,-1.204%,663439934.00,United States,2013,125256,Real Estate,Real Estate Investment Trusts
LANDM,Gladstone Land Corporation 5.00% Series D Cumulative Term Preferred Stock,$24.1051,-0.1449,-0.598%,580990907.00,United States,,481,Real Estate,Real Estate Investment Trusts
LANDO,Gladstone Land Corporation 6.00% Series B Cumulative Redeemable Preferred Stock,$23.9025,-0.2575,-1.066%,0.00,United States,,21213,Real Estate,Real Estate Investment Trusts
LARK,Landmark Bancorp Inc. Common Stock,$23.44,-0.16,-0.678%,122198158.00,United States,,10568,Finance,Major Banks
LASE,Laser Photonics Corporation Common Stock,$6.16,-0.36,-5.521%,48531049.00,United States,2022,163604,Industrials,Industrial Machinery/Components
LASR,nLIGHT Inc. Common Stock,$12.78,0.14,1.108%,579024751.00,United States,2018,115918,Technology,Semiconductors
LATG,LatAmGrowth SPAC Class A Ordinary Shares,$10.36,0.00,0.00%,168350000.00,Mexico,2022,8,Finance,Business Services
LATGU,LatAmGrowth SPAC Unit,$10.41,0.00,0.00%,0.00,Mexico,2022,7500,Finance,Business Services
LATGW,LatAmGrowth SPAC Warrants,$0.15,0.0596,65.929%,0.00,Mexico,2022,1252,Finance,Business Services
LAUR,Laureate Education Inc. Common Stock,$10.65,-0.03,-0.281%,1668815361.00,United States,2017,616768,Consumer Discretionary,Service to the Health Industry
LAZR,Luminar Technologies Inc.  Class A Common Stock,$6.945,-0.955,-12.089%,2519353275.00,United States,2019,8449243,Consumer Discretionary,Auto Parts:O.E.M.
LAZY,Lazydays Holdings Inc. Common Stock,$12.82,-0.03,-0.233%,135080532.00,United States,,48900,Consumer Discretionary,Other Specialty Stores
LBAI,Lakeland Bancorp Inc. Common Stock,$19.93,0.31,1.58%,1292893041.00,United States,,111839,Finance,Major Banks
LBBB,Lakeshore Acquisition II Corp. Ordinary Shares,$10.29,0.00,0.00%,94066035.00,United States,2022,3964,Finance,Business Services
