Symbol,Name,Last Sale,Net Change,% Change,Market Cap,Country,IPO Year,Volume,Sector,Industry
CTAQU,Carney Technology Acquisition Corp. II Units,$10.20,0.00,0.00%,0.00,United States,2020,12,Industrials,Consumer Electronics/Appliances
CTAQW,Carney Technology Acquisition Corp. II Warrant,$0.10,0.00,0.00%,0.00,United States,2021,15133,Industrials,Consumer Electronics/Appliances
CTAS,Cintas Corporation Common Stock,$440.97,2.06,0.469%,44811582625.00,United States,1983,150398,Consumer Discretionary,Business Services
CTBI,Community Trust Bancorp Inc. Common Stock,$44.3651,0.1351,0.305%,794946284.00,United States,,16878,Finance,Major Banks
CTG,Computer Task Group Inc. Common Stock,$7.3789,-0.1311,-1.746%,115940605.00,United States,,5486,Technology,EDP Services
CTHR,Charles & Colvard Ltd Common Stock,$0.8898,-0.004,-0.448%,27159993.00,United States,1997,15964,Consumer Discretionary,Consumer Specialties
CTIB,Yunhong CTI Ltd. Common Stock,$2.01,0.03,1.515%,32278773.00,United States,1997,21221,Miscellaneous,Diversified Commercial Services
CTIC,CTI BioPharma Corp. (DE) Common Stock,$5.49,-0.03,-0.543%,696649174.00,United States,1997,1216043,Health Care,Biotechnology: Pharmaceutical Preparations
CTKB,Cytek Biosciences Inc. Common Stock,$13.16,-0.03,-0.227%,1774670204.00,United States,2021,213907,Health Care,Biotechnology: Electromedical & Electrotherapeutic Apparatus
CTLP,Cantaloupe Inc. Common Stock,$5.15,0.05,0.98%,373164108.00,United States,,63114,Technology,EDP Services
CTMX,CytomX Therapeutics Inc. Common Stock,$2.715,-0.125,-4.401%,179419056.00,United States,2015,1000178,Health Care,Biotechnology: Pharmaceutical Preparations
CTRM,Castor Maritime Inc. Common Shares,$1.3299,0.0399,3.093%,125821956.00,Cyprus,,296222,Consumer Discretionary,Marine Transportation
CTRN,Citi Trends Inc. Common Stock,$33.38,-0.09,-0.269%,278931759.00,United States,2005,51098,,
CTSH,Cognizant Technology Solutions Corporation Class A Common Stock,$67.35,0.52,0.778%,34281150000.00,United States,1998,2338838,Technology,EDP Services
CTSO,Cytosorbents Corporation Common Stock,$3.8426,-0.3274,-7.851%,167674598.00,United States,,199804,Health Care,Medical/Dental Instruments
CTXR,Citius Pharmaceuticals Inc. Common Stock,$1.39,0.06,4.511%,203233471.00,United States,,484831,Health Care,Biotechnology: Pharmaceutical Preparations
CUBA,Herzfeld Caribbean Basin Fund Inc. (The) Common Stock,$4.195,0.0552,1.333%,27917561.00,United States,,39023,Finance,Investment Managers
CUE,Cue Biopharma Inc. Common Stock,$3.69,-0.03,-0.806%,158827002.00,United States,2018,27465,Health Care,Biotechnology: Pharmaceutical Preparations
CUEN,Cuentas Inc. Common Stock,$1.17,0.04,3.54%,22568989.00,United States,,282997,Technology,Computer Software: Prepackaged Software
CUENW,Cuentas Inc. Warrant,$0.12,0.00,0.00%,0.00,United States,,1000,Technology,Computer Software: Prepackaged Software
CULL,Cullman Bancorp Inc. Common Stock,$11.78,0.00,0.00%,87241420.00,United States,2021,47,Finance,Savings Institutions
CURI,CuriosityStream Inc. Class A Common Stock,$1.70,-0.08,-4.494%,89770396.00,United States,2020,40392,Industrials,Broadcasting
CURIW,CuriosityStream Inc. Warrant,$0.1195,0.0045,3.913%,0.00,United States,2020,6436,Industrials,Broadcasting
CUTR,Cutera Inc. Common Stock,$35.42,-0.75,-2.074%,694780231.00,United States,2004,208551,Health Care,Biotechnology: Electromedical & Electrotherapeutic Apparatus
CVAC,CureVac N.V. Ordinary Shares,$9.28,-1.30,-12.287%,1765828430.00,Germany,2020,2290949,Health Care,Biotechnology: Pharmaceutical Preparations
CVBF,CVB Financial Corporation Common Stock,$25.42,0.21,0.833%,3554191430.00,United States,,245375,Finance,Major Banks
CVCO,Cavco Industries Inc. Common Stock When Issued,$284.595,14.945,5.542%,2494007301.00,United States,,68956,Consumer Discretionary,Homebuilding
CVCY,Central Valley Community Bancorp Common Stock,$25.60,0.03,0.117%,300423450.00,United States,,23033,Finance,Major Banks
CVGI,Commercial Vehicle Group Inc. Common Stock,$8.28,-0.02,-0.241%,276336571.00,United States,2004,140597,Consumer Discretionary,Auto Parts:O.E.M.
CVGW,Calavo Growers Inc. Common Stock,$32.11,-0.39,-1.20%,569363635.00,United States,,33618,Consumer Discretionary,Specialty Foods
CVKD,Cadrenal Therapeutics Inc. Common Stock,$2.19,-0.06,-2.667%,25479719.00,United States,2023,51879,Health Care, Medicinal Chemicals and Botanical Products 
CVLG,Covenant Logistics Group Inc. Class A Common Stock,$34.86,1.26,3.75%,470410949.00,United States,,72930,Industrials,Trucking Freight/Courier Services
CVLT,Commvault Systems Inc. Common Stock,$64.065,0.435,0.684%,2854307485.00,United States,2006,181935,Technology,Computer Software: Prepackaged Software
CVLY,Codorus Valley Bancorp Inc Common Stock,$25.70,0.16,0.626%,246231700.00,United States,,5953,Finance,Savings Institutions
CVRX,CVRx Inc. Common Stock,$18.065,0.065,0.361%,372748441.00,United States,2021,161075,Health Care,Biotechnology: Electromedical & Electrotherapeutic Apparatus
CVT,Cvent Holding Corp. Common Stock,$7.51,-0.02,-0.266%,3664288963.00,United States,1987,134787,Technology,Computer Software: Prepackaged Software
CVV,CVD Equipment Corporation Common Stock,$12.85,0.13,1.022%,86878053.00,United States,,16593,Technology,Industrial Machinery/Components
CWBC,Community West Bancshares Common Stock,$14.98,0.03,0.201%,131794040.00,United States,,171,Finance,Major Banks
CWBR,CohBar Inc. Common Stock,$2.56,0.01,0.392%,7441731.00,United States,,7268,Health Care,Biotechnology: In Vitro & In Vivo Diagnostic Substances
CWCO,Consolidated Water Co. Ltd. Ordinary Shares,$15.18,-0.10,-0.654%,237726253.00,Cayman Islands,,24322,Utilities,Water Supply
CWST,Casella Waste Systems Inc. Class A Common Stock,$78.068,-1.402,-1.764%,4034573991.00,United States,1997,106673,Utilities,Environmental Services
CXDO,Crexendo Inc. Common Stock,$1.79,0.04,2.286%,45139692.00,United States,,7415,Consumer Discretionary,Telecommunications Equipment
CYAD,Celyad Oncology SA American Depositary Shares,$1.4999,0.37,32.746%,33888675.00,Belgium,2015,13736472,Health Care,Biotechnology: Pharmaceutical Preparations
CYAN,Cyanotech Corporation Common Stock,$1.38,0.01,0.73%,8655320.00,United States,,7904,Consumer Staples,Farming/Seeds/Milling
CYBR,CyberArk Software Ltd. Ordinary Shares,$145.99,3.02,2.112%,5944176871.00,Israel,2014,301266,Technology,Computer Software: Prepackaged Software
CYCC,Cyclacel Pharmaceuticals Inc. Common Stock,$1.04,0.03,2.97%,13040757.00,United States,,16407,Health Care,Biotechnology: Pharmaceutical Preparations
CYCCP,Cyclacel Pharmaceuticals Inc. 6% Convertible Preferred Stock,$15.74,0.74,4.933%,0.00,United States,,1533,Health Care,Biotechnology: Pharmaceutical Preparations
CYCN,Cyclerion Therapeutics Inc. Common Stock,$0.6914,-0.0067,-0.96%,30071879.00,United States,,35058,Health Care,Biotechnology: Pharmaceutical Preparations
CYN,Cyngn Inc. Common Stock,$1.1399,0.0399,3.627%,38392733.00,United States,2021,390756,Technology,EDP Services
CYRN,CYREN Ltd. Ordinary Shares,$0.4801,-0.0349,-6.777%,3840708.00,United States,,195709,Technology,Computer Software: Prepackaged Software
CYRX,CryoPort Inc. Common Stock,$23.68,-0.35,-1.457%,1160316188.00,United States,,132099,,
CYT,Cyteir Therapeutics Inc. Common Stock,$1.62,-0.005,-0.308%,57411037.00,United States,2021,39439,Health Care,Biotechnology: Pharmaceutical Preparations
CYTH,Cyclo Therapeutics Inc. Common Stock,$1.66,-0.03,-1.775%,16288823.00,United States,,36752,Health Care,Biotechnology: Pharmaceutical Preparations
CYTHW,Cyclo Therapeutics Inc. Warrant,$0.3097,0.032,11.523%,0.00,United States,,1200,Health Care,Biotechnology: Pharmaceutical Preparations
CYTK,Cytokinetics Incorporated Common Stock,$44.24,-0.60,-1.338%,4186475484.00,United States,2004,198368,Health Care,Biotechnology: Pharmaceutical Preparations
CYTO,Altamira Therapeutics Ltd. 0.2 Common Shares (Bermuda),$2.87,-0.05,-1.712%,3719787.00,Bermuda,2014,17431,Health Care,Biotechnology: Pharmaceutical Preparations
CYXT,Cyxtera Technologies Inc. Class A Common Stock,$2.59,-0.03,-1.145%,465209343.00,United States,2020,268023,Technology,EDP Services
CZFS,Citizens Financial Services Inc. Common Stock,$87.82,3.93,4.685%,348751574.00,United States,,2590,Finance,Major Banks
CZNC,Citizens & Northern Corp Common Stock,$23.22,0.03,0.129%,360346977.00,United States,,7504,Finance,Major Banks
CZR,Caesars Entertainment Inc. Common Stock,$54.58,1.08,2.019%,11711018011.00,United States,,1094597,Consumer Discretionary,Hotels/Resorts
CZWI,Citizens Community Bancorp Inc. Common Stock,$12.72,0.02,0.157%,132607514.00,United States,2006,10677,Finance,Savings Institutions
DADA,Dada Nexus Limited American Depositary Shares,$12.62,0.30,2.435%,3225534505.00,China,2020,1724781,Consumer Discretionary,Department/Specialty Retail Stores
DAIO,Data I/O Corporation Common Stock,$4.47,0.04,0.903%,39409223.00,United States,1981,3462,Technology,Industrial Machinery/Components
DAKT,Daktronics Inc. Common Stock,$4.09,0.06,1.489%,185954828.00,United States,1994,77083,Industrials,Office Equipment/Supplies/Services
DALN,DallasNews Corporation Series A Common Stock,$5.55,0.09,1.648%,29706320.00,United States,,89570,Consumer Discretionary,Newspapers/Magazines
DALS,DA32 Life Science Tech Acquisition Corp. Class A Common Stock,$10.02,0.00,0.00%,257013000.00,United States,2021,397,Industrials,Consumer Electronics/Appliances
DARE,Dare Bioscience Inc. Common Stock,$1.20,-0.03,-2.439%,101760000.00,United States,2014,152586,Health Care,Biotechnology: Pharmaceutical Preparations
DATS,DatChat Inc. Common Stock,$0.6801,0.0036,0.532%,14008305.00,United States,2021,44178,Technology,Computer Software: Prepackaged Software
DATSW,DatChat Inc. Series A Warrant,$0.1335,0.0496,59.118%,0.00,United States,2021,1222,Technology,Computer Software: Prepackaged Software
DAVE,Dave Inc. Class A Common Stock,$9.73,-0.12,-1.218%,114968104.00,United States,,19379,Technology,Retail: Computer Software & Peripheral Equipment
DAVEW,Dave Inc. Warrants,$0.05,-0.0052,-9.42%,0.00,United States,,41987,Technology,Retail: Computer Software & Peripheral Equipment
DAWN,Day One Biopharmaceuticals Inc. Common Stock,$21.13,-0.10,-0.471%,1554101484.00,United States,2021,291048,Health Care,Biotechnology: Pharmaceutical Preparations
DBGI,Digital Brands Group Inc. Common Stock,$2.91,-0.26,-8.202%,6316117.00,United States,2021,434054,Consumer Discretionary,Apparel
DBGIW,Digital Brands Group Inc. Warrant,$2.07,0.26,14.365%,0.00,United States,2021,736,Consumer Discretionary,Apparel
DBTX,Decibel Therapeutics Inc. Common Stock,$3.65,0.11,3.107%,91120432.00,United States,2021,31885,Health Care,Biotechnology: Pharmaceutical Preparations
DBVT,DBV Technologies S.A. American Depositary Shares,$1.35,-0.03,-2.174%,253710606.00,France,2014,101840,Health Care,Biotechnology: Pharmaceutical Preparations
DBX,Dropbox Inc. Class A Common Stock,$23.94,0.50,2.133%,8683908889.00,United States,2018,1123985,Technology,Computer Software: Prepackaged Software
DCBO,Docebo Inc. Common Shares,$39.095,-0.405,-1.025%,1286478210.00,Canada,,70481,,
DCFC,Tritium DCFC Limited Ordinary Shares,$1.375,-0.055,-3.846%,213797177.00,Australia,,1579423,Technology,Electronic Components
DCFCW,Tritium DCFC Limited Warrant,$0.4518,0.00,0.00%,0.00,Australia,,100,Technology,Electronic Components
DCGO,DocGo Inc. Common Stock,$9.69,-0.20,-2.022%,992364160.00,United States,2020,313562,Health Care,Managed Health Care
DCOM,Dime Community Bancshares Inc. Common Stock,$31.37,0.19,0.609%,1210055934.00,United States,,74564,Finance,Savings Institutions
DCOMP,Dime Community Bancshares Inc. Fixed-Rate Non-Cumulative Perpetual Preferred Stock Series A,$21.29,-0.1162,-0.543%,0.00,United States,,9936,Finance,Savings Institutions
DCPH,Deciphera Pharmaceuticals Inc. Common Stock,$16.42,-0.29,-1.735%,1241737246.00,United States,2017,389052,Health Care,Biotechnology: Pharmaceutical Preparations
DCRD,Decarbonization Plus Acquisition Corporation IV Class A Ordinary Share,$9.99,-0.31,-3.01%,394917188.00,United States,2021,21760,Finance,Business Services
DCRDU,Decarbonization Plus Acquisition Corporation IV Unit,$10.24,-0.47,-4.388%,0.00,United States,2021,1839,Finance,Business Services
DCRDW,Decarbonization Plus Acquisition Corporation IV Warrant,$0.6924,-0.0076,-1.086%,0.00,United States,2021,85500,Finance,Business Services
DCT,Duck Creek Technologies Inc. Common Stock,$18.895,-0.005,-0.026%,2510922709.00,United States,2020,380045,Technology,Retail: Computer Software & Peripheral Equipment
DCTH,Delcath Systems Inc. Common Stock,$4.35,0.27,6.618%,43702584.00,United States,,70961,Health Care,Medical Specialities
DDI,DoubleDown Interactive Co. Ltd. American Depository Shares,$9.70,0.51,5.55%,480668368.00,South Korea,2021,14429,Technology,EDP Services
DDOG,Datadog Inc. Class A Common Stock,$79.39,2.43,3.157%,25211075539.00,United States,2019,2717405,Technology,EDP Services
DECA,Denali Capital Acquisition Corp. Class A Ordinary Shares,$10.36,0.01,0.097%,112121100.00,United States,2022,184963,Finance,Business Services
DECAU,Denali Capital Acquisition Corp. Unit,$10.4001,0.00,0.00%,0.00,United States,2022,25,Finance,Business Services
DECAW,Denali Capital Acquisition Corp. Warrant,$0.075,0.015,25.00%,0.00,United States,2022,150,Finance,Business Services
DENN,Denny's Corporation Common Stock,$12.76,0.05,0.393%,730296576.00,United States,,235719,Consumer Discretionary,Restaurants
DERM,Journey Medical Corporation Common Stock,$2.31,0.27,13.235%,41038767.00,United States,2021,27175,Health Care,Biotechnology: Pharmaceutical Preparations
DFFN,Diffusion Pharmaceuticals Inc. Common Stock,$6.30,0.02,0.318%,12848485.00,United States,,5312,Health Care,Biotechnology: Pharmaceutical Preparations
DFLI,Dragonfly Energy Holdings Corp. Common Stock,$6.80,-0.06,-0.875%,294254550.00,United States,2021,15748,Technology,Electronic Components
DFLIW,Dragonfly Energy Holdings Corp. Warrant,$0.37,-0.0874,-19.108%,0.00,United States,2021,1757,Technology,Electronic Components
DGHI,Digihost Technology Inc. Common Subordinate Voting Shares,$1.537,-0.093,-5.706%,42763664.00,Canada,,232317,,
DGICA,Donegal Group Inc. Class A Common Stock,$15.275,-0.185,-1.197%,495949861.00,United States,,6852,Finance,Property-Casualty Insurers
DGICB,Donegal Group Inc. Class B Common Stock,$15.657,0.127,0.818%,508352666.00,United States,1986,864,Finance,Property-Casualty Insurers
DGII,Digi International Inc. Common Stock,$35.815,-0.025,-0.07%,1280158717.00,United States,1989,143443,Technology,Computer peripheral equipment
DGLY,Digital Ally Inc. Common Stock,$0.27,-0.0945,-25.926%,14553919.00,United States,,1560899,Technology,Security Systems Services
DGNU,Dragoneer Growth Opportunities Corp. III Class A Ordinary Shares,$9.89,0.00,0.00%,532423284.00,United States,2021,4401,Finance,Business Services
DH,Definitive Healthcare Corp. Class A Common Stock,$13.035,0.135,1.047%,1369718608.00,United States,2021,242304,Technology,Computer Software: Prepackaged Software
DHAC,Digital Health Acquisition Corp. Common Stock,$10.99,0.0008,0.007%,45346092.00,United States,2021,1000,Industrials,Consumer Electronics/Appliances
DHC,Diversified Healthcare Trust Common Shares of Beneficial Interest,$0.7106,-0.0068,-0.948%,170333421.00,United States,,1951511,Real Estate,Real Estate Investment Trusts
DHCA,DHC Acquisition Corp. Class A ordinary share,$10.16,-0.005,-0.049%,393002414.00,United States,2021,190288,Finance,Business Services
DHCNI,Diversified Healthcare Trust 5.625% Senior Notes due 2042,$12.18,-0.11,-0.895%,0.00,United States,,25862,Real Estate,Real Estate Investment Trusts
DHCNL,Diversified Healthcare Trust 6.25% Senior Notes Due 2046,$13.48,-0.07,-0.517%,0.00,United States,,17503,Real Estate,Real Estate Investment Trusts
DHHC,DiamondHead Holdings Corp. Class A Common Stock,$10.07,-0.07,-0.69%,131574942.00,United States,2021,3537,Industrials,Consumer Electronics/Appliances
DHHCW,DiamondHead Holdings Corp. Warrant,$0.20,0.0104,5.485%,0.00,United States,2021,225,Industrials,Consumer Electronics/Appliances
DHIL,Diamond Hill Investment Group Inc. Class A Common Stock,$186.86,-0.13,-0.07%,563542665.00,United States,,2113,Finance,Investment Managers
DIBS,1stdibs.com Inc. Common Stock,$6.12,-0.18,-2.857%,238256306.00,United States,2021,127089,Miscellaneous,Diversified Commercial Services
DICE,DICE Therapeutics Inc. Common Stock,$29.67,-1.56,-4.995%,1414157650.00,United States,2021,192214,Health Care,Biotechnology: Pharmaceutical Preparations
DIOD,Diodes Incorporated Common Stock,$96.10,4.45,4.855%,4369639419.00,United States,,187970,Technology,Semiconductors
DISA,Disruptive Acquisition Corporation I Class A Ordinary Shares,$10.1757,0.0157,0.155%,349789688.00,United States,2021,22871,Finance,Business Services
DISAU,Disruptive Acquisition Corporation I Unit,$10.17,0.00,0.00%,0.00,United States,2021,1024,Finance,Business Services
DISAW,Disruptive Acquisition Corporation I Warrant,$0.0301,0.00,0.00%,0.00,United States,2021,8,Finance,Business Services
DISH,DISH Network Corporation Class A Common Stock,$14.48,-0.18,-1.228%,7684629700.00,United States,1995,2043967,Consumer Discretionary,Telecommunications Equipment
DJCO,Daily Journal Corp. (S.C.) Common Stock,$305.12,0.00,0.00%,420158173.00,United States,,363,Technology,Retail: Computer Software & Peripheral Equipment
DKDCA,Data Knights Acquisition Corp. Class A Common Stock,$10.61,0.00,0.00%,158727457.00,United Kingdom,2021,8,Industrials,Consumer Electronics/Appliances
DKDCW,Data Knights Acquisition Corp. Warrant,$0.04,0.004,11.111%,0.00,United Kingdom,2021,35000,Industrials,Consumer Electronics/Appliances
DKNG,DraftKings Inc. Class A Common Stock,$17.435,0.485,2.861%,7825668977.00,United States,2019,13706926,Consumer Discretionary,Services-Misc. Amusement & Recreation
DLHC,DLH Holdings Corp.,$13.259,-0.041,-0.308%,182403652.00,United States,,26235,Consumer Discretionary,Business Services
DLO,DLocal Limited Class A Common Shares,$16.68,0.17,1.03%,4937031318.00,Uruguay,2021,348673,Consumer Discretionary,Business Services
DLPN,Dolphin Entertainment Inc. Common Stock,$2.1511,-0.1139,-5.029%,21971447.00,United States,,17370,Consumer Discretionary,Advertising
DLTH,Duluth Holdings Inc. Class B Common Stock,$6.70,-0.13,-1.903%,223932124.00,United States,2015,48193,Consumer Discretionary,Department/Specialty Retail Stores
DLTR,Dollar Tree Inc. Common Stock,$150.00,-0.97,-0.643%,33177671850.00,United States,1995,634801,Consumer Discretionary,Department/Specialty Retail Stores
DMAC,DiaMedica Therapeutics Inc. Common Stock,$1.35,0.03,2.273%,35698140.00,United States,2018,59082,Health Care,Pharmaceuticals and Biotechnology
DMAQ,Deep Medicine Acquisition Corp. Class A Common Stock,$10.30,0.00,0.00%,169261960.00,United States,2021,190,Industrials,Consumer Electronics/Appliances
DMAQR,Deep Medicine Acquisition Corp. Rights,$0.10,0.00,0.00%,0.00,United States,2021,20320,,
DMLP,Dorchester Minerals L.P. Common Units Representing Limited Partnership Interests,$29.20,0.99,3.509%,1120447596.00,United States,,77132,Energy,Oil & Gas Production
DMRC,Digimarc Corporation Common Stock,$20.77,0.05,0.241%,416146785.00,United States,,40811,Technology,EDP Services
DMTK,DermTech Inc. Common Stock,$5.18,-0.04,-0.766%,156512172.00,United States,2017,309300,Health Care,Managed Health Care
DNAB,Social Capital Suvretta Holdings Corp. II Class A Ordinary Shares,$10.14,0.00,0.00%,323364600.00,United States,2021,5177,Finance,Business Services
DNAD,Social Capital Suvretta Holdings Corp. IV Class A Ordinary Shares,$10.13,0.01,0.099%,323045700.00,United States,2021,118851,Finance,Business Services
DNLI,Denali Therapeutics Inc. Common Stock,$31.29,-0.06,-0.191%,4249609672.00,United States,2017,373463,Health Care,Biotechnology: Biological Products (No Diagnostic Substances)
DNUT,Krispy Kreme Inc. Common Stock,$12.50,-0.15,-1.186%,2092964038.00,United States,2021,199186,Consumer Discretionary,Specialty Foods
DOCU,DocuSign Inc. Common Stock,$65.11,2.16,3.431%,13091937776.00,United States,2018,1892693,Technology,EDP Services
DOGZ,Dogness (International) Corporation Class A Common Stock,$1.0099,-0.0101,-0.99%,39663074.00,China,2017,77143,Consumer Discretionary,Miscellaneous manufacturing industries
DOMH,Dominari Holdings Inc. Common Stock,$4.00,-0.07,-1.72%,21940384.00,United States,,63896,Health Care, Medicinal Chemicals and Botanical Products 
DOMO,Domo Inc. Class B Common Stock,$15.70,-0.18,-1.134%,542355966.00,United States,2018,394801,Technology,Computer Software: Prepackaged Software
DOOO,BRP Inc. (Recreational Products) Common Subordinate Voting Shares,$89.16,-0.14,-0.157%,7020945838.00,Canada,,30005,,
DORM,Dorman Products Inc. Common Stock,$94.625,-3.075,-3.147%,2972982659.00,United States,,85820,Consumer Discretionary,Auto Parts:O.E.M.
DOX,Amdocs Limited Ordinary Shares,$95.08,2.09,2.248%,11487242518.00,Guernsey,,671348,Technology,EDP Services
DOYU,DouYu International Holdings Limited ADS,$1.65,0.01,0.61%,523848336.00,China,2019,1327148,Technology,Computer Software: Programming Data Processing
DPCS,DP Cap Acquisition Corp I Class A Ordinary Shares,$10.33,0.00,0.00%,296987500.00,United States,2021,97400,Finance,Business Services
DPCSW,DP Cap Acquisition Corp I Warrants,$0.0718,0.0133,22.735%,0.00,United States,2021,6647,Finance,Business Services
DPRO,Draganfly Inc. Common Shares,$1.6197,-0.2603,-13.846%,54748340.00,Canada,,708197,Consumer Discretionary,Electronic Components
DRCT,Direct Digital Holdings Inc. Class A Common Stock,$5.31,-0.08,-1.484%,75285180.00,United States,2022,46933,Consumer Discretionary,Advertising
DRCTW,Direct Digital Holdings Inc. Warrant,$1.32,-0.11,-7.692%,0.00,United States,2022,1901,Consumer Discretionary,Advertising
DRIO,DarioHealth Corp. Common Stock,$5.75,0.08,1.411%,147656608.00,Israel,,87037,Health Care,Medical/Dental Instruments
DRMA,Dermata Therapeutics Inc. Common Stock,$0.29,-0.0098,-3.269%,3573336.00,United States,2021,90046,Health Care,Biotechnology: Pharmaceutical Preparations
DRMAW,Dermata Therapeutics Inc. Warrant,$0.0474,0.0001,0.211%,0.00,United States,2021,542,Health Care,Biotechnology: Pharmaceutical Preparations
DRRX,DURECT Corporation Common Stock,$6.2679,0.4679,8.067%,142820263.00,United States,2000,58394,Health Care,Biotechnology: Pharmaceutical Preparations
DRS,Leonardo DRS Inc. Common Stock,$13.07,-0.12,-0.91%,3400647488.00,Israel,,532235,Industrials,Military/Government/Technical
DRTS,Alpha Tau Medical Ltd. Ordinary Shares,$3.70,0.01,0.271%,255342735.00,Israel,,32034,Health Care,Medical/Dental Instruments
DRTSW,Alpha Tau Medical Ltd. Warrant,$0.42,-0.005,-1.176%,0.00,Israel,,1228,Health Care,Medical/Dental Instruments
DRTT,DIRTT Environmental Solutions Ltd. Common Shares,$0.592,0.0292,5.188%,57650375.00,Canada,,27363,,
DRUG,Bright Minds Biosciences Inc. Common Stock,$0.785,0.0169,2.20%,14687632.00,Canada,,300294,Health Care,Pharmaceuticals and Biotechnology
DRVN,Driven Brands Holdings Inc. Common Stock,$28.385,-0.085,-0.299%,4751763874.00,United States,2021,275039,,
DSEY,Diversey Holdings Ltd. Ordinary Shares,$6.04,-0.01,-0.165%,1958868417.00,United States,2021,134478,Consumer Discretionary,Specialty Chemicals
DSGN,Design Therapeutics Inc. Common Stock,$7.905,0.005,0.063%,441969111.00,United States,2021,178637,Health Care,Biotechnology: Pharmaceutical Preparations
DSGR,Distribution Solutions Group Inc. Common Stock,$45.095,0.695,1.565%,888918818.00,United States,,13686,Industrials,Industrial Machinery/Components
DSGX,Descartes Systems Group Inc. (The) Common Stock,$76.18,-0.49,-0.639%,6461434783.00,Canada,,69143,,
DSKE,Daseke Inc. Common Stock,$8.90,0.55,6.587%,399388310.00,United States,2015,482119,,
DSP,Viant Technology Inc. Class A Common Stock,$4.695,0.115,2.511%,67890094.00,United States,2021,88547,Technology,EDP Services
DSWL,Deswell Industries Inc. Common Shares,$3.16,0.0091,0.289%,50355355.00,Macau,1995,1372,Industrials,Plastic Products
DTEA,DAVIDsTEA Inc. Common Stock,$1.025,-0.025,-2.381%,27235311.00,Canada,2015,3574,,
DTIL,Precision BioSciences Inc. Common Stock,$1.19,-0.02,-1.653%,132041156.00,United States,2019,231790,Health Care,Biotechnology: Pharmaceutical Preparations
DTOC,Digital Transformation Opportunities Corp. Class A Common Stock,$10.125,0.00,0.00%,422085938.00,United States,2021,222503,Industrials,Consumer Electronics/Appliances
DTOCU,Digital Transformation Opportunities Corp. Units,$10.12,0.00,0.00%,0.00,United States,2021,929,Industrials,Consumer Electronics/Appliances
DTOCW,Digital Transformation Opportunities Corp. Warrant,$0.0794,0.0372,88.152%,0.00,United States,2021,110,Industrials,Consumer Electronics/Appliances
DTSS,Datasea Inc. Common Stock,$1.35,-0.026,-1.89%,32838255.00,China,,5734,Technology,Retail: Computer Software & Peripheral Equipment
DTST,Data Storage Corporation Common Stock,$1.82,0.0495,2.796%,12416271.00,United States,,15176,Technology,EDP Services
DTSTW,Data Storage Corporation Warrant,$0.1989,0.00,0.00%,0.00,United States,,1,Technology,EDP Services
DUET,DUET Acquisition Corp. Class A Common Stock,$10.22,0.00,0.00%,115051650.00,Malaysia,2022,81,Miscellaneous,Other Pharmaceuticals
DUETU,DUET Acquisition Corp. Unit,$10.23,0.00,0.00%,0.00,Malaysia,2022,295,Miscellaneous,Other Pharmaceuticals
DUNE,Dune Acquisition Corporation Class A Common Stock,$9.89,-0.0102,-0.103%,54341139.00,United States,2021,100,Industrials,Consumer Electronics/Appliances
DUNEU,Dune Acquisition Corporation Unit,$9.90,0.00,0.00%,0.00,United States,2020,140,Industrials,Consumer Electronics/Appliances
DUO,Fangdd Network Group Ltd. American Depositary Shares,$1.15,-0.01,-0.862%,7588606.00,China,2019,22494,Technology,Computer Software: Programming Data Processing
DUOL,Duolingo Inc. Class A Common Stock,$93.60,-5.50,-5.55%,3759887383.00,United States,2021,387214,Technology,Computer Software: Prepackaged Software
DUOT,Duos Technologies Group Inc. Common Stock,$5.1921,0.1721,3.428%,37159211.00,United States,,124074,Technology,Computer Software: Prepackaged Software
